tracked_root,model,region,artifact,section,page_key,file_name,relative_path,section_title,field_key,change_type,old_value,new_value,source_section_key,source_row_key,source_line_order,source_csv_line,from_ref,to_ref
docs/_review/JE-1000F/JP,JE-1000F,JP,review,generated,03_product_overview_ja,03_product_overview_ja.rst,generated/JE-1000F/draft/03_product_overview_ja.rst,正面,メイン電源ボタン -> 主電源ボタン,M,持ち手,ハンドル,CONTROLS,tpl_main_power_button_label,1,77,HEAD~1,HEAD
docs/_review/JE-1000F/JP,JE-1000F,JP,review,generated,03_product_overview_ja,03_product_overview_ja.rst,generated/JE-1000F/draft/03_product_overview_ja.rst,正面,12Vシガーソケット出力 12V/10A 最大 -> シガーソケット出力ポート 12V⎓最大10A,M,LCDディスプレイ,LCDディスプレイ,OUTPUT PORTS,tpl_front_dc12_port_label; tpl_front_dc12_port_spec,1,80; 81,HEAD~1,HEAD
docs/_review/JE-1000F/JP,JE-1000F,JP,review,generated,03_product_overview_ja,03_product_overview_ja.rst,generated/JE-1000F/draft/03_product_overview_ja.rst,正面,USB-C 30W出力 5V/3A、9V/3A、12V/2.5A、15V/2A、20V/1.5A、最大30W -> USB-C 30W出力ポート 5V⎓3A，9V⎓3A，12V⎓2.5A，15V⎓2A，20V⎓1.5A，最大30W,M,LEDライト,LEDライト,OUTPUT PORTS,tpl_front_usb_c_low_spec; tpl_front_usb_c_low_label,1,83; 82,HEAD~1,HEAD
docs/_review/JE-1000F/JP,JE-1000F,JP,review,generated,03_product_overview_ja,03_product_overview_ja.rst,generated/JE-1000F/draft/03_product_overview_ja.rst,正面,USB-C 100W出力 5V/3A、9V/3A、12V/3A、15V/3A、20V/5A、最大100W -> USB-C 100W出力ポート 5V⎓3A，9V⎓3A，12V⎓3A，15V⎓3A，20V⎓5A，最大100W,M,AC出力ボタン,AC出力ボタン,OUTPUT PORTS; CONTROLS,tpl_usb_c_high_power_port_label; tpl_ac_power_button_label; tpl_front_usb_c_high_spec; tpl_front_usb_c_high_label; tpl_usb_c_high_power_port_label; tpl_ac_power_button_label,1,99; 79; 85; 84; 99; 79,HEAD~1,HEAD
docs/_review/JE-1000F/JP,JE-1000F,JP,review,generated,03_product_overview_ja,03_product_overview_ja.rst,generated/JE-1000F/draft/03_product_overview_ja.rst,正面,USB-A 18W出力 5-6V/3A、6-9V/2A、9-12V/1.5A、最大18W -> USB-A 18W出力ポート 5-6V⎓3A，6-9V⎓2A，9-12V⎓1.5A，最大18W,M,AC出力 100V~50/60Hz、15A、定格1500W、瞬間最大3000W,AC出力ポート 100V~ 50Hz/60Hz，最大15A，定格1500W，瞬間最大3000W,OUTPUT PORTS,tpl_ups_bypass_output_text; tpl_front_ac_output_spec; tpl_front_usb_a_spec; tpl_front_usb_a_label; tpl_front_ac_output_label; tpl_ups_bypass_output_text,1,100; 89; 87; 86; 88; 100,HEAD~1,HEAD
docs/_review/JE-1000F/JP,JE-1000F,JP,review,generated,05_operation_guide_ja,05_operation_guide_ja.rst,generated/JE-1000F/draft/05_operation_guide_ja.rst,ボタン操作,メイン電源ボタン + AC出力ボタン / 両方を3秒間長押し -> AC出力ボタン + USB出力ボタン / 両方を1秒間長押し,M,省エネモードのオン/ オフを切り替えます。,Wi-Fi＆Bluetooth オン/オフ,CONTROLS,tpl_ac_power_button_label,1,79,HEAD~1,HEAD
docs/_review/JE-1000F/JP,JE-1000F,JP,review,generated,05_operation_guide_ja,05_operation_guide_ja.rst,generated/JE-1000F/draft/05_operation_guide_ja.rst,LCDスクリーン,.. image:: _assets/templates/word_template/common_assets/operation/lcd_mode.png :alt: LCD display mode diagram. :width: 140px / 短くオン / オンにする / メイン電源ボタンを押すか、充電入力がある場合。 * / 短くオン / オフにする / メイン電源ボタンを押します。 * / 短くオン / 自動オフ / 2分後にLCDは自動的に消灯し、スリープモードになります。 * / 常時オン / オンにする / デバイスが起動している状態でメイン電源ボタンを2回押します。 * / 常時オン / オフにする / メイン電源ボタンを押します。 * / 常時オン / 自動オフ -> .. image:: _assets/templates/word_template/common_assets/operation/lcd_mode.png :alt: LCD display mode diagram. :width: 140px / 短くオン / オンにする / 主電源ボタンを押すか、充電入力がある場合。 * / 短くオン / オフにする / 主電源ボタンを押します。 * / 短くオン / 自動オフ / 2分後にLCDは自動的に消灯し、スリープモードになります。 * / 常時オン / オンにする / デバイスが起動している状態で主電源ボタンを2回押します。 * / 常時オン / オフにする / 主電源ボタンを押します。 * / 常時オン / 自動オフ,M,常時点灯ディスプレイモードは、2時間操作がないと自動的に消灯します。,常時点灯ディスプレイモードは、2時間操作がないと自動的に消灯します。,SETTINGS; CONTROLS; SETTINGS,tpl_default_standby_duration; tpl_main_power_button_label; tpl_default_standby_duration,1,95; 77; 95,HEAD~1,HEAD
docs/_review/JE-1000F/JP,JE-1000F,JP,review,generated,05_operation_guide_ja,05_operation_guide_ja.rst,generated/JE-1000F/draft/05_operation_guide_ja.rst,ボタン操作,メイン電源ボタン + DC/USB出力ボタン / 両方を3秒間長押し,D,Wi-Fiのリセット,,CONTROLS,tpl_dc_usb_power_button_label,1,78,HEAD~1,HEAD
docs/_review/JE-1000F/JP,JE-1000F,JP,review,generated,05_operation_guide_ja,05_operation_guide_ja.rst,generated/JE-1000F/draft/05_operation_guide_ja.rst,ボタン操作,DC/USB出力ボタン + AC出力ボタン / 両方を1秒間長押し,D,Wi-Fi＆Bluetooth オン/オフ,,CONTROLS,tpl_dc_usb_power_button_label; tpl_ac_power_button_label,1,78; 79,HEAD~1,HEAD
docs/_review/JE-1000F/JP,JE-1000F,JP,review,generated,05_operation_guide_ja,05_operation_guide_ja.rst,generated/JE-1000F/draft/05_operation_guide_ja.rst,ボタン操作,主電源ボタン + AC出力ボタン / 両方を3秒間長押し,A,,省エネモードのオン/ オフを切り替えます。,CONTROLS,tpl_ac_power_button_label; tpl_main_power_button_label,1,79; 77,HEAD~1,HEAD
docs/_review/JE-1000F/JP,JE-1000F,JP,review,generated,05_operation_guide_ja,05_operation_guide_ja.rst,generated/JE-1000F/draft/05_operation_guide_ja.rst,ボタン操作,主電源ボタン + DC/USB出力ボタン / 両方を3秒間長押し,A,,Wi-Fiのリセット,CONTROLS,tpl_dc_usb_power_button_label; tpl_main_power_button_label,1,78; 77,HEAD~1,HEAD
docs/_review/JE-1000F/JP,JE-1000F,JP,review,generated,05_operation_guide_ja,05_operation_guide_ja.rst,generated/JE-1000F/draft/05_operation_guide_ja.rst,ボタン操作,主電源ボタン + ライトボタン / 両方を1秒間長押し,A,,緊急充電モードのオン/オフを切り替えます。,CONTROLS,tpl_main_power_button_label,1,77,HEAD~1,HEAD
docs/_review/JE-1000F/JP,JE-1000F,JP,review,generated,12_app_setup_ja,12_app_setup_ja.rst,generated/JE-1000F/draft/12_app_setup_ja.rst,デバイスを追加するには,備考,A,,バインド処理中に「デバイスがバインドされました」と表示された場合は、以下の2つの方法で接続できます： * デバイス所有者は、アプリを通じてこのデバイスを他のユーザーと共有します。 * 主電源ボタンとDC/USB出力ボタンを同時に3秒間押すと、Wi-FiとBluetoothが初期化されます。,CONTROLS,tpl_dc_usb_power_button_label; tpl_main_power_button_label,1,78; 77,HEAD~1,HEAD
docs/_review/JE-1000F/JP,JE-1000F,JP,review,generated,12_app_setup_ja,12_app_setup_ja.rst,generated/JE-1000F/draft/12_app_setup_ja.rst,デバイスを追加するには,備考 #2,A,,2.4GHz帯のWi-Fiネットワークを選択してください。デバイスは、5GHz帯のWi-Fiネットワークには対応していません。,,,,,HEAD~1,HEAD
docs/_review/JE-1000F/JP,JE-1000F,JP,review,page,01_meaning_of_symbols,01_meaning_of_symbols.rst,page/01_meaning_of_symbols.rst,絵表示について,警告,D,この表示を無視して、誤った取り扱いをすると、人が死亡または重傷を負う可能性が想定される内容を示しています。,,,,,,HEAD~1,HEAD
docs/_review/JE-1000F/JP,JE-1000F,JP,review,page,01_meaning_of_symbols,01_meaning_of_symbols.rst,page/01_meaning_of_symbols.rst,絵表示について,注意,D,この表示を無視して、誤った取り扱いをすると、人が傷害を負う可能性が想定される内容または物的損害の発生が想定される内容を示しています。,,,,,,HEAD~1,HEAD
docs/_review/JE-1000F/JP,JE-1000F,JP,review,page,01_meaning_of_symbols,01_meaning_of_symbols.rst,page/01_meaning_of_symbols.rst,絵表示について,説明,D,この表示を無視して誤った取り扱いをすると、機器の損傷、データの消失、性能の低下、または予期しない動作が発生する可能性があることを示しています。,,,,,,HEAD~1,HEAD
docs/_review/JE-1000F/JP,JE-1000F,JP,review,page,01_meaning_of_symbols,01_meaning_of_symbols.rst,page/01_meaning_of_symbols.rst,絵表示について,ヒント,D,文章内の重要な情報や操作のヒントを補足する内容を示しています。,,,,,,HEAD~1,HEAD
docs/_review/JE-1000F/JP,JE-1000F,JP,review,page,01_meaning_of_symbols,01_meaning_of_symbols.rst,page/01_meaning_of_symbols.rst,絵表示の説明,.. image:: _assets/templates/word_template/common_assets/symbols/warning_triangle.png :alt: Warning and caution symbol. :width: 40px / 潜在的な危険やリスクについて注意喚起するために、必ずお読みください。 / .. image:: _assets/templates/word_template/common_assets/symbols/weee.png :alt: WEEE disposal symbol. :width: 40px,D,このシンボルは、本製品を一般家庭ごみとして廃棄せず、リサイクルのために指定の回収施設に持ち込む必要があることを示しています。 適切な廃棄およびリサイクルは、環境保護に役立ちます。 本製品の廃棄やリサイクルについての詳細は、お住まいの自治体、廃棄物処理業者、または販売店にお問い合わせください。,,,,,,HEAD~1,HEAD
docs/_review/JE-1000F/JP,JE-1000F,JP,review,page,01_meaning_of_symbols,01_meaning_of_symbols.rst,page/01_meaning_of_symbols.rst,絵表示の説明,.. image:: _assets/templates/word_template/common_assets/symbols/read_manual.png :alt: Read manual symbol. :width: 40px / 操作の前に取扱説明書をお読みください。 / .. image:: _assets/templates/word_template/common_assets/symbols/prohibited.png :alt: Keep away from fire symbol. :width: 40px,D,本製品を火気の近くに置かないでください。,,,,,,HEAD~1,HEAD
docs/_review/JE-1000F/JP,JE-1000F,JP,review,page,01_meaning_of_symbols,01_meaning_of_symbols.rst,page/01_meaning_of_symbols.rst,絵表示の説明,.. image:: _assets/templates/word_template/common_assets/symbols/prohibited.png :alt: Keep away from children symbol. :width: 40px / 小さなお子様の手の届かない場所に保管してください。 / .. image:: _assets/templates/word_template/common_assets/symbols/battery_recycle.png :alt: Battery disposal symbol. :width: 40px,D,~~電池および蓄電池は家庭ごみと一緒に廃棄してはいけません。~~ ~~消費者の皆様は、有害物質の有無にかかわらず、すべての電池および蓄電池を指定された収集場所で廃棄することが法律で義務付けられています。~~ ~~使用済みの電池および蓄電池は、お近くの収集拠点、リサイクルセンター、または購入した小売店にお持ちください。 適切な廃棄は環境に配慮したリサイクルを確保し、人間の健康と環境への潜在的な害を防ぎます。~~,,,,,,HEAD~1,HEAD
docs/_review/JE-1000F/JP,JE-1000F,JP,review,page,01_meaning_of_symbols,01_meaning_of_symbols.rst,page/01_meaning_of_symbols.rst,絵表示の説明,.. image:: _assets/templates/word_template/common_assets/symbols/do_not_dismantle.png :alt: Do not dismantle symbol. :width: 40px / 製品を分解、改造を禁止する記号 / .. image:: _assets/templates/word_template/common_assets/symbols/li_ion.png :alt: Li-ion symbol. :width: 40px,D,充電式電池のリサイクルについて 本機はリサイクル可能な充電池を内蔵しています。 この商品を廃棄する場合は、当社のカスタマーサポートにご連絡ください。 充電池の取りはずしはお客様自身では行わないでください。,,,,,,HEAD~1,HEAD
docs/_review/JE-1000F/JP,JE-1000F,JP,review,page,01_meaning_of_symbols,01_meaning_of_symbols.rst,page/01_meaning_of_symbols.rst,絵表示の説明,.. image:: _assets/templates/word_template/common_assets/symbols/unplug.png :alt: Unplug symbol. :width: 40px / コンセントから電源プラグを抜く記号 / .. image:: _assets/templates/word_template/common_assets/symbols/mandatory.png :alt: Mandatory action symbol. :width: 40px,D,行為を指示する記号,,,,,,HEAD~1,HEAD
docs/_review/JE-1000F/JP,JE-1000F,JP,review,page,01_meaning_of_symbols,01_meaning_of_symbols.rst,page/01_meaning_of_symbols.rst,絵表示の説明,.. image:: _assets/templates/word_template/common_assets/symbols/no_wet_hands.png :alt: No wet hands symbol. :width: 40px / 製品に濡れた手で触れることを禁止する記号 / .. image:: _assets/templates/word_template/common_assets/symbols/prohibited.png :alt: Prohibited action symbol. :width: 40px,D,行為を禁止する記号,,,,,,HEAD~1,HEAD
docs/_review/JE-1000F/JP,JE-1000F,JP,review,page,01_meaning_of_symbols,01_meaning_of_symbols.rst,page/01_meaning_of_symbols.rst,絵表示の説明,.. image:: _assets/templates/word_template/common_assets/symbols/keep_dry.png :alt: Keep dry symbol. :width: 40px,D,製品を濡らすことを禁止する記号,,,,,,HEAD~1,HEAD
docs/_review/JE-1000F/JP,JE-1000F,JP,review,page,01_meaning_of_symbols,01_meaning_of_symbols.rst,page/01_meaning_of_symbols.rst,警告,.. image:: _assets/templates/word_template/common_assets/symbols/warning_triangle.png :alt: Warning icon. :width: 40px / 火のそばや炎天下の車内、熱器具の周辺など高温（45℃以上）になる場所で使用したり、放置しない 発熱や発火、破裂する原因になります。 / .. image:: _assets/templates/word_template/common_assets/symbols/warning_triangle.png :alt: Warning icon. :width: 40px,D,端子部にケーブル以外の金属類を差し込まない 発熱や発火の原因になります。,,,,,,HEAD~1,HEAD
docs/_review/JE-1000F/JP,JE-1000F,JP,review,page,01_meaning_of_symbols,01_meaning_of_symbols.rst,page/01_meaning_of_symbols.rst,警告,.. image:: _assets/templates/word_template/common_assets/symbols/warning_triangle.png :alt: Warning icon. :width: 40px / 強い衝撃を与えたり、投げつけたりしない 発熱や発火、破裂する原因になります。 / .. image:: _assets/templates/word_template/common_assets/symbols/warning_triangle.png :alt: Warning icon. :width: 40px,D,雷が鳴りだしたら、電源プラグにふれない (充電をしない) 感電の原因になります。,,,,,,HEAD~1,HEAD
docs/_review/JE-1000F/JP,JE-1000F,JP,review,page,01_meaning_of_symbols,01_meaning_of_symbols.rst,page/01_meaning_of_symbols.rst,警告,.. image:: _assets/templates/word_template/common_assets/symbols/warning_triangle.png :alt: Warning icon. :width: 40px / 水など、液体を入れたり、濡らしたりしない 発熱や発火の原因になります。 / .. image:: _assets/templates/word_template/common_assets/symbols/mandatory.png :alt: Mandatory symbol. :width: 40px,D,各接続端子には確実に差し込む 差し込みが不十分だと、発熱したりほこりが付着して火災や感電の原因になります。,,,,,,HEAD~1,HEAD
docs/_review/JE-1000F/JP,JE-1000F,JP,review,page,01_meaning_of_symbols,01_meaning_of_symbols.rst,page/01_meaning_of_symbols.rst,警告,.. image:: _assets/templates/word_template/common_assets/symbols/no_wet_hands.png :alt: No wet hands icon. :width: 40px / 濡れた手で本体や接続するケーブルを触らない 火災や感電の原因になります。 / .. image:: _assets/templates/word_template/common_assets/symbols/grounding.png :alt: Grounding icon. :width: 40px,D,接地接続は必ず、電源プラグを電源につなぐ前に行って下さい また、接地接続を外す場合は、必ず電源プラグを切り離してから行って下さい。,,,,,,HEAD~1,HEAD
docs/_review/JE-1000F/JP,JE-1000F,JP,review,page,01_meaning_of_symbols,01_meaning_of_symbols.rst,page/01_meaning_of_symbols.rst,警告,.. image:: _assets/templates/word_template/common_assets/symbols/unplug.png :alt: Unplug icon. :width: 40px,D,万が一、次のような異常が発生したときはすぐに使用をやめる * 煙が出ている、異臭がする * 内部に水や異物が入ったとき * 落としたり、破損したとき * 電源コード (AC充電ケーブル) が傷んだとき * 異音がする このような異常が発生したまま使用していると、火災や感電の原因になります。 すぐにAC充電ケーブルをコンセントから抜いてください。また、本製品に接続されている機器もすべて外してください。 万が一発煙や発火したら、大量の水で消火して煙が見えなくなるまで本製品を水浸しにしてください。 煙が出なくなることを確認してからカスタマーサポートにご連絡ください。 お客様による修理は危険ですので絶対におやめください。,,,,,,HEAD~1,HEAD
docs/_review/JE-1000F/JP,JE-1000F,JP,review,page,01_meaning_of_symbols,01_meaning_of_symbols.rst,page/01_meaning_of_symbols.rst,警告,.. image:: _assets/templates/word_template/common_assets/symbols/do_not_dismantle.png :alt: Do not dismantle icon. :width: 40px,D,分解、改造しない 故障、発熱、火災·感電の原因になります。,,,,,,HEAD~1,HEAD
docs/_review/JE-1000F/JP,JE-1000F,JP,review,page,01_meaning_of_symbols,01_meaning_of_symbols.rst,page/01_meaning_of_symbols.rst,警告,.. image:: _assets/templates/word_template/common_assets/symbols/prohibited.png :alt: Do not use incompatible voltage icon. :width: 40px,D,表示された電源電圧以外で使用しない 故障、発熱、火災·感電の原因になります。また、本製品を使用できるのは日本国内のみです。,,,,,,HEAD~1,HEAD
docs/_review/JE-1000F/JP,JE-1000F,JP,review,page,01_meaning_of_symbols,01_meaning_of_symbols.rst,page/01_meaning_of_symbols.rst,警告,.. image:: _assets/templates/word_template/common_assets/symbols/do_not_dismantle.png :alt: Do not self-repair icon. :width: 40px,D,付属品と本製品が破損した場合は、ご自身で修理をしない,,,,,,HEAD~1,HEAD
docs/_review/JE-1000F/JP,JE-1000F,JP,review,page,01_meaning_of_symbols,01_meaning_of_symbols.rst,page/01_meaning_of_symbols.rst,注意,.. image:: _assets/templates/word_template/common_assets/symbols/warning_triangle.png :alt: Caution icon. :width: 40px,D,本製品の上に物を載せたり、不安定な場所に置かない 倒れたり、落ちたりしてけがの原因になります。,,,,,,HEAD~1,HEAD
docs/_review/JE-1000F/JP,JE-1000F,JP,review,page,01_meaning_of_symbols,01_meaning_of_symbols.rst,page/01_meaning_of_symbols.rst,注意,.. image:: _assets/templates/word_template/common_assets/symbols/warning_triangle.png :alt: Caution icon. :width: 40px #2,D,データサーバや医療機器など、非常時に不具合が起こると人命 / 財産に重大な危険を及ぼしうる用途でのご使用はお控えください。次のようなような機器では、万が一使用中に給電ができなくなった場合、人命 / 財産にかかわる被害が想定されます。 * 医療機器や使用上、生命に関わるような機器 * 社会的、公共的に重要な機器など * 重要な事業用機器など,,,,,,HEAD~1,HEAD
docs/_review/JE-1000F/JP,JE-1000F,JP,review,page,01_meaning_of_symbols,01_meaning_of_symbols.rst,page/01_meaning_of_symbols.rst,注意,.. image:: _assets/templates/word_template/common_assets/symbols/warning_triangle.png :alt: Caution icon. :width: 40px #3,D,心臓にペースメーカーを装着している方は使用しない ペースメーカーが、本製品の影響を受ける恐れがあります。,,,,,,HEAD~1,HEAD
docs/_review/JE-1000F/JP,JE-1000F,JP,review,page,01_meaning_of_symbols,01_meaning_of_symbols.rst,page/01_meaning_of_symbols.rst,注意,.. image:: _assets/templates/word_template/common_assets/symbols/warning_triangle.png :alt: Caution icon. :width: 40px #4,D,格納式ハンドルを使用してJackery ポータブル電源 1000 New を移動するときは、積み重ねたり、上に他の物を置いたりしないでください。落下して怪我をする場合があります。,,GENERAL INFO,product_name,1,26,HEAD~1,HEAD
docs/_review/JE-1000F/JP,JE-1000F,JP,review,page,01_meaning_of_symbols,01_meaning_of_symbols.rst,page/01_meaning_of_symbols.rst,使用上のご注意,ご注意,D,始動電力が出力上限値(定格出力)を大幅に超える可能性のある製品のご利用や、定格出力を超え給電がストップした製品を繰り返し利用することはポータブル電源のバッテリーが損傷するリスクがありますのでお控えください。,,,,,,HEAD~1,HEAD
docs/_review/JE-1000F/JP,JE-1000F,JP,review,page,01_meaning_of_symbols,01_meaning_of_symbols.rst,page/01_meaning_of_symbols.rst,・絵表示について,警告,A,,この表示を無視して、誤った取り扱いをすると、人が死亡または重傷を負う可能性が想定される内容を示しています。,,,,,HEAD~1,HEAD
docs/_review/JE-1000F/JP,JE-1000F,JP,review,page,01_meaning_of_symbols,01_meaning_of_symbols.rst,page/01_meaning_of_symbols.rst,・絵表示について,注意,A,,この表示を無視して、誤った取り扱いをすると、人が傷害を負う可能性が想定される内容または物的損害の発生が想定される内容を示しています。,,,,,HEAD~1,HEAD
docs/_review/JE-1000F/JP,JE-1000F,JP,review,page,01_meaning_of_symbols,01_meaning_of_symbols.rst,page/01_meaning_of_symbols.rst,・絵表示について,説明,A,,この表示を無視して誤った取り扱いをすると、機器の損傷、データの消失、性能の低下、または予期しない動作が発生する可能性があることを示しています。,,,,,HEAD~1,HEAD
docs/_review/JE-1000F/JP,JE-1000F,JP,review,page,01_meaning_of_symbols,01_meaning_of_symbols.rst,page/01_meaning_of_symbols.rst,・絵表示について,ヒント,A,,文章内の重要な情報や操作のヒントを補足する内容を示しています。,,,,,HEAD~1,HEAD
docs/_review/JE-1000F/JP,JE-1000F,JP,review,page,01_meaning_of_symbols,01_meaning_of_symbols.rst,page/01_meaning_of_symbols.rst,・絵表示の説明,.. image:: _assets/templates/word_template/common_assets/symbols/warning_triangle.png :alt: Warning and caution symbol. :width: 40px / 潜在的な危険やリスクについて注意喚起するために、必ずお読みください。 / .. image:: _assets/templates/word_template/common_assets/symbols/weee.png :alt: WEEE disposal symbol. :width: 40px,A,,このシンボルは、本製品を一般家庭ごみとして廃棄せず、リサイクルのために指定の回収施設に持ち込む必要があることを示しています。 適切な廃棄およびリサイクルは、環境保護に役立ちます。 本製品の廃棄やリサイクルについての詳細は、お住まいの自治体、廃棄物処理業者、または販売店にお問い合わせください。,,,,,HEAD~1,HEAD
docs/_review/JE-1000F/JP,JE-1000F,JP,review,page,01_meaning_of_symbols,01_meaning_of_symbols.rst,page/01_meaning_of_symbols.rst,・絵表示の説明,.. image:: _assets/templates/word_template/common_assets/symbols/read_manual.png :alt: Read manual symbol. :width: 40px / 操作の前に取扱説明書をお読みください。 / .. image:: _assets/templates/word_template/common_assets/symbols/prohibited.png :alt: Keep away from fire symbol. :width: 40px,A,,本製品を火気の近くに置かないでください。,,,,,HEAD~1,HEAD
docs/_review/JE-1000F/JP,JE-1000F,JP,review,page,01_meaning_of_symbols,01_meaning_of_symbols.rst,page/01_meaning_of_symbols.rst,・絵表示の説明,.. image:: _assets/templates/word_template/common_assets/symbols/prohibited.png :alt: Keep away from children symbol. :width: 40px / 小さなお子様の手の届かない場所に保管してください。 / .. image:: _assets/templates/word_template/common_assets/symbols/battery_recycle.png :alt: Battery disposal symbol. :width: 40px,A,,電池および蓄電池は家庭ごみと一緒に廃棄してはいけません。 消費者の皆様は、有害物質の有無にかかわらず、すべての電池および蓄電池を指定された収集場所で廃棄することが法律で義務付けられています。 使用済みの電池および蓄電池は、お近くの収集拠点、リサイクルセンター、または購入した小売店にお持ちください。 適切な廃棄は環境に配慮したリサイクルを確保し、人間の健康と環境への潜在的な害を防ぎます。,,,,,HEAD~1,HEAD
